{
  "id": "thread-test-08",
  "title": "Test Threat 08",
  "state": "active",
  "playerSummary": "Test threat 08 keeps pressure on the board for layout checks.",
  "gmTruth": "Threat 08 is part of the seeded stress campaign used to inspect board density.",
  "timelineAnchor": "now",
  "linkedEntityIds": [
    "entity-zone-2",
    "entity-cross-6",
    "entity-pattern-anchor-1"
  ],
  "patternId": "pattern-test-1",
  "playerVisible": true
}
