{
  "id": "thread-test-51",
  "title": "Test Threat 51",
  "state": "active",
  "hook": "Pressure note 51 needs attention.",
  "playerSummary": "Test threat 51 keeps pressure on the board for layout checks.",
  "gmTruth": "Threat 51 is part of the seeded stress campaign used to inspect board density.",
  "timelineAnchor": "future_possible",
  "linkedEntityIds": [
    "entity-zone-3",
    "entity-cross-7",
    "entity-pattern-anchor-4",
    "entity-cross-11"
  ],
  "playerVisible": true
}
