{
  "id": "thread-scavenger-leader-ran-off-with-the-money",
  "title": "Scavenger Leader Ran Off With the Money",
  "state": "active",
  "hook": "A scavenger crew is reeling after its former leader disappeared with the money, leaving debt and resentment behind.",
  "playerSummary": "The scavengers have a missing-money problem, a fresh leader, and a reason to be desperate.",
  "gmTruth": "This side thread can grow into a debt problem, a missing-person problem, or a wider underworld opportunity tied to the bank and the city's labor ecosystem.",
  "timelineAnchor": "future_possible",
  "linkedEntityIds": [],
  "playerVisible": true
}
