{
  "id": "thread-test-40",
  "title": "Test Threat 40",
  "state": "escalated",
  "playerSummary": "Test threat 40 keeps pressure on the board for layout checks.",
  "gmTruth": "Threat 40 is part of the seeded stress campaign used to inspect board density.",
  "timelineAnchor": "past",
  "linkedEntityIds": [
    "entity-zone-4",
    "entity-cross-1",
    "entity-pattern-anchor-5"
  ],
  "patternId": "pattern-test-5",
  "playerVisible": true
}
